    1 0.000000000 172.100.100.4 → 172.100.100.7 TCP 74 49142 → 6030 [SYN] Seq=0 Win=64240 Len=0 MSS=1460 SACK_PERM TSval=3113307916 TSecr=0 WS=128
    2 0.046748601 172.100.100.7 → 172.100.100.4 TCP 74 6030 → 49142 [SYN, ACK] Seq=0 Ack=1 Win=65160 Len=0 MSS=1460 SACK_PERM TSval=2368535773 TSecr=3113307916 WS=128
    3 0.046790933 172.100.100.4 → 172.100.100.7 TCP 66 49142 → 6030 [ACK] Seq=1 Ack=1 Win=64256 Len=0 TSval=3113307962 TSecr=2368535773
    4 0.058032641 172.100.100.4 → 172.100.100.7 X11 90 49142 → 6030 [PSH, ACK] Seq=1 Ack=1 Win=64256 Len=24 TSval=3113307974 TSecr=2368535773
    5 0.058112035 172.100.100.7 → 172.100.100.4 TCP 66 6030 → 49142 [ACK] Seq=1 Ack=25 Win=65152 Len=0 TSval=2368535785 TSecr=3113307974
    6 0.058145525 172.100.100.4 → 172.100.100.7 TCP 75 49142 → 6030 [PSH, ACK] Seq=25 Ack=1 Win=64256 Len=9 TSval=3113307974 TSecr=2368535785
    7 0.058156295 172.100.100.7 → 172.100.100.4 TCP 66 6030 → 49142 [ACK] Seq=1 Ack=34 Win=65152 Len=0 TSval=2368535785 TSecr=3113307974
    8 0.078552913 172.100.100.7 → 172.100.100.4 X11 87 6030 → 49142 [PSH, ACK] Seq=1 Ack=34 Win=65152 Len=21 TSval=2368535805 TSecr=3113307974
    9 0.078600291 172.100.100.4 → 172.100.100.7 TCP 66 49142 → 6030 [ACK] Seq=34 Ack=22 Win=64256 Len=0 TSval=3113307994 TSecr=2368535805
   10 0.078886912 172.100.100.4 → 172.100.100.7 TCP 75 49142 → 6030 [PSH, ACK] Seq=34 Ack=22 Win=64256 Len=9 TSval=3113307994 TSecr=2368535805
   11 0.079189862 172.100.100.4 → 172.100.100.7 TCP 200 49142 → 6030 [PSH, ACK] Seq=43 Ack=22 Win=64256 Len=134 TSval=3113307995 TSecr=2368535805
   12 0.079244140 172.100.100.7 → 172.100.100.4 TCP 66 6030 → 49142 [ACK] Seq=22 Ack=177 Win=65024 Len=0 TSval=2368535806 TSecr=3113307994
   13 0.079651734 172.100.100.4 → 172.100.100.7 TCP 243 49142 → 6030 [PSH, ACK] Seq=177 Ack=22 Win=64256 Len=177 TSval=3113307995 TSecr=2368535806
   14 0.084260205 172.100.100.7 → 172.100.100.4 TCP 75 6030 → 49142 [PSH, ACK] Seq=22 Ack=354 Win=64896 Len=9 TSval=2368535811 TSecr=3113307995
   15 0.088313500 172.100.100.7 → 172.100.100.4 X11 96 Error: Success
   16 0.090807950 172.100.100.4 → 172.100.100.7 TCP 66 49142 → 6030 [ACK] Seq=354 Ack=61 Win=64256 Len=0 TSval=3113308006 TSecr=2368535811
   17 0.092985316 172.100.100.4 → 172.100.100.7 TCP 83 49142 → 6030 [PSH, ACK] Seq=354 Ack=61 Win=64256 Len=17 TSval=3113308009 TSecr=2368535811
   18 0.134306714 172.100.100.7 → 172.100.100.4 TCP 66 6030 → 49142 [ACK] Seq=61 Ack=371 Win=64896 Len=0 TSval=2368535861 TSecr=3113308009
   19 0.612904688 172.100.100.7 → 172.100.100.4 X11 1526 Event: ButtonPressEvent: ButtonPress, Sent-<Unknown eventcode 52>, FocusOut, FocusOut, <Unknown eventcode 116>, CirculateNotify, <Unknown eventcode 117>, Success, <Unknown eventcode 115>, <Unknown eventcode 49>, <Unknown eventcode 112>, <Unknown eventcode 101>, FocusIn, ButtonRelease, <Unknown eventcode 100>, GravityNotify, FocusOut, <Unknown eventcode 117>, CirculateNotify, FocusOut, <Unknown errorcode 110>, CirculateNotify, CirculateNotify, <Unknown eventcode 45>
   20 0.615281038 172.100.100.4 → 172.100.100.7 TCP 66 49142 → 6030 [ACK] Seq=371 Ack=1521 Win=64128 Len=0 TSval=3113308531 TSecr=2368536339
   21 0.616921865 172.100.100.4 → 172.100.100.7 TCP 96 49142 → 6030 [PSH, ACK] Seq=371 Ack=1521 Win=64128 Len=30 TSval=3113308532 TSecr=2368536339
   22 0.618529987 172.100.100.7 → 172.100.100.4 TCP 66 6030 → 49142 [ACK] Seq=1521 Ack=401 Win=64896 Len=0 TSval=2368536344 TSecr=3113308532
   23 0.618686662 172.100.100.7 → 172.100.100.4 TCP 762 6030 → 49142 [PSH, ACK] Seq=1521 Ack=401 Win=64896 Len=696 TSval=2368536345 TSecr=3113308532
   24 0.631990700 172.100.100.7 → 172.100.100.4 TCP 83 6030 → 49142 [PSH, ACK] Seq=2217 Ack=401 Win=64896 Len=17 TSval=2368536359 TSecr=3113308532
   25 0.632086176 172.100.100.4 → 172.100.100.7 TCP 66 49142 → 6030 [ACK] Seq=401 Ack=2234 Win=64128 Len=0 TSval=3113308548 TSecr=2368536345
   26 5.614157052 172.100.100.7 → 172.100.100.4 TCP 1167 6030 → 49142 [PSH, ACK] Seq=2234 Ack=401 Win=64896 Len=1101 TSval=2368541341 TSecr=3113308548
   27 5.620511067 172.100.100.4 → 172.100.100.7 TCP 96 49142 → 6030 [PSH, ACK] Seq=401 Ack=3335 Win=64128 Len=30 TSval=3113313536 TSecr=2368541341
   28 5.628393758 172.100.100.7 → 172.100.100.4 TCP 1099 6030 → 49142 [PSH, ACK] Seq=3335 Ack=431 Win=64896 Len=1033 TSval=2368541355 TSecr=3113313536
   29 5.670250104 172.100.100.4 → 172.100.100.7 TCP 66 49142 → 6030 [ACK] Seq=431 Ack=4368 Win=64128 Len=0 TSval=3113313586 TSecr=2368541355
   30 10.614345178 172.100.100.7 → 172.100.100.4 TCP 1526 6030 → 49142 [PSH, ACK] Seq=4368 Ack=431 Win=64896 Len=1460 TSval=2368546341 TSecr=3113313586
   31 10.614421057 172.100.100.4 → 172.100.100.7 TCP 66 49142 → 6030 [ACK] Seq=431 Ack=5828 Win=64128 Len=0 TSval=3113318530 TSecr=2368546341
   32 10.617113077 172.100.100.4 → 172.100.100.7 TCP 96 49142 → 6030 [PSH, ACK] Seq=431 Ack=5828 Win=64128 Len=30 TSval=3113318533 TSecr=2368546341
   33 10.620665433 172.100.100.7 → 172.100.100.4 TCP 720 6030 → 49142 [PSH, ACK] Seq=5828 Ack=461 Win=64896 Len=654 TSval=2368546347 TSecr=3113318533
   34 10.639420567 172.100.100.7 → 172.100.100.4 TCP 83 6030 → 49142 [PSH, ACK] Seq=6482 Ack=461 Win=64896 Len=17 TSval=2368546366 TSecr=3113318533
   35 10.639915069 172.100.100.4 → 172.100.100.7 TCP 66 49142 → 6030 [ACK] Seq=461 Ack=6499 Win=64128 Len=0 TSval=3113318555 TSecr=2368546347
   36 15.631740221 172.100.100.7 → 172.100.100.4 TCP 1526 6030 → 49142 [PSH, ACK] Seq=6499 Ack=461 Win=64896 Len=1460 TSval=2368551358 TSecr=3113318555
   37 15.631783695 172.100.100.4 → 172.100.100.7 TCP 66 49142 → 6030 [ACK] Seq=461 Ack=7959 Win=64128 Len=0 TSval=3113323547 TSecr=2368551358
   38 15.637740016 172.100.100.4 → 172.100.100.7 TCP 96 49142 → 6030 [PSH, ACK] Seq=461 Ack=7959 Win=64128 Len=30 TSval=3113323553 TSecr=2368551358
   39 15.637977627 172.100.100.7 → 172.100.100.4 TCP 720 6030 → 49142 [PSH, ACK] Seq=7959 Ack=491 Win=64896 Len=654 TSval=2368551365 TSecr=3113323553
   40 15.674361748 172.100.100.4 → 172.100.100.7 TCP 66 49142 → 6030 [ACK] Seq=491 Ack=8613 Win=64128 Len=0 TSval=3113323590 TSecr=2368551365
   41 15.703456748 172.100.100.7 → 172.100.100.4 TCP 83 6030 → 49142 [PSH, ACK] Seq=8613 Ack=491 Win=64896 Len=17 TSval=2368551430 TSecr=3113323590
   42 15.703493916 172.100.100.4 → 172.100.100.7 TCP 66 49142 → 6030 [ACK] Seq=491 Ack=8630 Win=64128 Len=0 TSval=3113323619 TSecr=2368551430
   43 20.615716176 172.100.100.7 → 172.100.100.4 TCP 722 6030 → 49142 [PSH, ACK] Seq=8630 Ack=491 Win=64896 Len=656 TSval=2368556342 TSecr=3113323619
   44 20.615751305 172.100.100.4 → 172.100.100.7 TCP 66 49142 → 6030 [ACK] Seq=491 Ack=9286 Win=64128 Len=0 TSval=3113328531 TSecr=2368556342
   45 20.616962857 172.100.100.4 → 172.100.100.7 TCP 96 49142 → 6030 [PSH, ACK] Seq=491 Ack=9286 Win=64128 Len=30 TSval=3113328533 TSecr=2368556342
   46 20.665249348 172.100.100.7 → 172.100.100.4 TCP 66 6030 → 49142 [ACK] Seq=9286 Ack=521 Win=64896 Len=0 TSval=2368556392 TSecr=3113328533
   47 20.673573152 172.100.100.7 → 172.100.100.4 TCP 1431 6030 → 49142 [PSH, ACK] Seq=9286 Ack=521 Win=64896 Len=1365 TSval=2368556400 TSecr=3113328533
   48 20.688161979 172.100.100.7 → 172.100.100.4 TCP 83 6030 → 49142 [PSH, ACK] Seq=10651 Ack=521 Win=64896 Len=17 TSval=2368556415 TSecr=3113328533
   49 20.744736545 172.100.100.4 → 172.100.100.7 TCP 66 49142 → 6030 [ACK] Seq=521 Ack=10668 Win=64128 Len=0 TSval=3113328660 TSecr=2368556400
   50 25.623128568 172.100.100.7 → 172.100.100.4 TCP 1526 6030 → 49142 [PSH, ACK] Seq=10668 Ack=521 Win=64896 Len=1460 TSval=2368561350 TSecr=3113328660
   51 25.623170248 172.100.100.4 → 172.100.100.7 TCP 66 49142 → 6030 [ACK] Seq=521 Ack=12128 Win=64128 Len=0 TSval=3113333539 TSecr=2368561350
   52 25.624058352 172.100.100.4 → 172.100.100.7 TCP 96 49142 → 6030 [PSH, ACK] Seq=521 Ack=12128 Win=64128 Len=30 TSval=3113333540 TSecr=2368561350
   53 25.624598234 172.100.100.7 → 172.100.100.4 TCP 66 6030 → 49142 [ACK] Seq=12128 Ack=551 Win=64896 Len=0 TSval=2368561351 TSecr=3113333540
   54 25.624747218 172.100.100.7 → 172.100.100.4 TCP 627 6030 → 49142 [PSH, ACK] Seq=12128 Ack=551 Win=64896 Len=561 TSval=2368561351 TSecr=3113333540
   55 25.633896972 172.100.100.7 → 172.100.100.4 TCP 83 6030 → 49142 [PSH, ACK] Seq=12689 Ack=551 Win=64896 Len=17 TSval=2368561360 TSecr=3113333540
   56 25.633955387 172.100.100.4 → 172.100.100.7 TCP 66 49142 → 6030 [ACK] Seq=551 Ack=12706 Win=64128 Len=0 TSval=3113333550 TSecr=2368561351
   57 30.611822722 172.100.100.7 → 172.100.100.4 TCP 1526 6030 → 49142 [PSH, ACK] Seq=12706 Ack=551 Win=64896 Len=1460 TSval=2368566338 TSecr=3113333550
   58 30.611885637 172.100.100.4 → 172.100.100.7 TCP 66 49142 → 6030 [ACK] Seq=551 Ack=14166 Win=64128 Len=0 TSval=3113338527 TSecr=2368566338
   59 30.612535208 172.100.100.7 → 172.100.100.4 TCP 807 6030 → 49142 [PSH, ACK] Seq=14166 Ack=551 Win=64896 Len=741 TSval=2368566339 TSecr=3113338527
   60 30.613837918 172.100.100.4 → 172.100.100.7 TCP 96 49142 → 6030 [PSH, ACK] Seq=551 Ack=14907 Win=64128 Len=30 TSval=3113338529 TSecr=2368566339
   61 30.638793242 172.100.100.7 → 172.100.100.4 TCP 83 6030 → 49142 [PSH, ACK] Seq=14907 Ack=581 Win=64896 Len=17 TSval=2368566365 TSecr=3113338529
   62 30.682279968 172.100.100.4 → 172.100.100.7 TCP 66 49142 → 6030 [ACK] Seq=581 Ack=14924 Win=64128 Len=0 TSval=3113338598 TSecr=2368566365
   63 34.170524178 172.100.100.4 → 172.100.100.7 TCP 66 49142 → 6030 [FIN, ACK] Seq=581 Ack=14924 Win=64128 Len=0 TSval=3113342086 TSecr=2368566365
   64 34.206875066 172.100.100.7 → 172.100.100.4 TCP 66 6030 → 49142 [FIN, ACK] Seq=14924 Ack=582 Win=64896 Len=0 TSval=2368569933 TSecr=3113342086
   65 34.206904790 172.100.100.4 → 172.100.100.7 TCP 66 49142 → 6030 [ACK] Seq=582 Ack=14925 Win=64128 Len=0 TSval=3113342122 TSecr=2368569933
